URL Links,Department Initials,Title,Catalog Page,Courses
https://www.utdallas.edu/fact-sheets/nsm/ms-actuarial-science/,nsm,Master of Science in Actuarial Science,https://catalog.utdallas.edu/now/graduate/programs/nsm/mathematics#master-of-science-in-actuarial-science,"['MATH 6301 Real Analysis', 'MATH 6303 Theory of Complex Functions I', 'MATH 6311 Abstract Algebra I', 'MATH 6315 Ordinary Differential Equations', 'MATH 6302 Functional Analysis I', 'MATH 6309 Differential Geometry', 'MATH 6310 Topology', 'MATH 6312 Combinatorics and Graph Theory', 'MATH 6325 Nonlinear Analysis I', 'MATH 7313 Partial Differential Equations I', 'MATH 7361 Algebraic Geometry and Non-linear Equations', 'MATH 6313 Numerical Analysis', 'MATH 6315 Ordinary Differential Equations', 'MATH 6319 Principles and Techniques in Applied Mathematics I', 'MATH 6321 Optimization', 'MATH 5301 Elementary Analysis I and  Elementary Analysis II', 'or MATH 6301 Real Analysis', 'MATH 6303 Theory of Complex Functions I', 'MATH 6308 Inverse Problems and Applications', 'MATH 6312 Combinatorics and Graph Theory', 'MATH 6318 Numerical Analysis of Differential Equations', 'MATH 6320 Principles and Techniques in Applied Mathematics II', 'MATH 6324 Applied Dynamical Systems I', 'MATH 6336 Nonlinear Control Systems', 'MATH 6340 Numerical Linear Algebra', 'MATH 6342 Scientific Computing', 'MATH 7313 Partial Differential Equations I', 'MATH 5301 Elementary Analysis I (or equivalent)', 'MATH 5302 Elementary Analysis II (or equivalent)', 'MATH 6305 Mathematics of Signal Processing', 'MATH 6321 Optimization', 'MATH 6331 Mathematics of Signals, Systems, and Controls', 'MATH 7318 or  Stochastic Dynamic Programming', 'STAT 5353 Probability and Statistics for Data Science and Bioinformatics', 'STAT 6329 Applied Probability and Stochastic Processes', 'or MATH 6364 Stochastic Calculus in Finance', 'STAT 6340 Statistical and Machine Learning', 'FIN 6381 Introductory Mathematical Finance', 'or ACTS 6308 Actuarial Financial Mathematics', 'CS 5303 Computer Science I', 'CS 5343 Algorithm Analysis and Data Structures', 'CS 6307 Introduction to Big Data Management and Analytics for non CS-Majors', 'CS 6375 Machine Learning', 'MATH 6312 Combinatorics and Graph Theory', 'MATH 6321 Optimization', 'MATH 6340 Numerical Linear Algebra', 'or MATH 6319 Principles and Techniques in Applied Mathematics I', 'MATH 6322 Mathematical Foundations of Data Science', 'STAT 5353 Probability and Statistics for Data Science and Bioinformatics', 'STAT 6340 Statistical and Machine Learning', 'STAT 6331 Statistical Inference I', 'STAT 6337 Advanced Statistical Methods I', 'STAT 6338 Advanced Statistical Methods II', 'STAT 6339 Linear Statistical Models', 'STAT 6341 Numerical Linear Algebra and Statistical Computing', 'STAT 6329 Applied Probability and Stochastic Processes', 'or STAT 7345 Advanced Probability and Stochastic Processes', 'STAT 6348 Applied Multivariate Analysis', 'or STAT 7331 Multivariate Analysis', 'STAT 6347 Applied Time Series Analysis', 'or STAT 7338 Time Series Modeling and Filtering', 'STAT 7330 Bayesian Data Analysis', 'STAT 7334 Nonparametric and Robust Statistical Methods', 'MATH 5301 Elementary Analysis I', 'MATH 5302 Elementary Analysis II', 'STAT 5351 Probability and Statistics I', 'STAT 5352 Probability and Statistics II', 'STAT 5351 Probability and Statistics I', 'STAT 5352 Probability and Statistics II', 'STAT 6337 Advanced Statistical Methods I', 'STAT 6338 Advanced Statistical Methods II', 'STAT 6341 Numerical Linear Algebra and Statistical Computing', 'STAT 6329 Applied Probability and Stochastic Processes', 'STAT 6347 Applied Time Series Analysis', 'STAT 6348 Applied Multivariate Analysis', 'STAT 7330 Bayesian Data Analysis', 'CS 5303 Computer Science I', 'CS 5343 Algorithm Analysis and Data Structures', 'CS 6307 Introduction to Big Data Management and Analytics for non CS-Majors', 'CS 6375 Machine Learning', 'MATH 6312 Combinatorics and Graph Theory', 'STAT 5351 Probability and Statistics I', 'STAT 5352 Probability and Statistics II', 'STAT 6337 Advanced Statistical Methods I', 'STAT 6338 Advanced Statistical Methods II', 'STAT 6348 Applied Multivariate Analysis', 'STAT 6340 Statistical and Machine Learning', 'STAT 5351 Probability and Statistics I', 'STAT 5352 Probability and Statistics II', 'ACTS 6301 Principles of Long Term Actuarial Mathematics I', 'ACTS 6303 Principles of Long Term Actuarial Mathematics II', 'ACTS 6304 Principles of Short Term Actuarial Mathematics I', 'ACTS 6305 Principles of Short Term Actuarial Mathematics II', 'ACTS 6307 Advanced Statistics for Risk Modeling', 'ACTS 6310 Advanced Predictive Analytics', 'ACTS 6302 Investment and Financial Markets', 'ACTS 6306 Theory of Credibility', 'ACTS 6308 Actuarial Financial Mathematics', 'ACCT 6301   Financial Accounting', 'ACCT 6305 Accounting for Managers', 'FIN 6301 Financial Management', 'FIN 6308 Regulation of Business and Financial Markets', 'FIN 6310 Investment Theory and Practice', 'FIN 6314 Fixed Income Securities', 'FIN 6360 Derivatives Markets', 'FIN 6382 Numerical and Statistical Methods in Finance', 'MATH 6313 Numerical Analysis', 'MECO 6303 Business Economics', 'OPRE 6301 Statistics and Data Analysis', 'OPRE 6335 Risk and Decision Analysis', 'PPPE 6321 Economics for Public Policy', 'STAT 6329 Applied Probability and Stochastic Processes', 'STAT 6331 Statistical Inference I', 'STAT 6337 Advanced Statistical Methods I', 'STAT 6338 Advanced Statistical Methods II', 'STAT 6347 Applied Time Series Analysis', 'STAT 6348 Applied Multivariate Analysis', 'STAT 6390 Topics in Statistics - Level 6', 'STAT 7330 Bayesian Data Analysis', 'STAT 7334 Nonparametric and Robust Statistical Methods', 'STAT 7338 Time Series Modeling and Filtering', 'Exam 1/P: STAT 5351 and ', 'Exam 2/FM: ACTS 6308', 'Exam 3L/FAM/ALTAM: ACTS 6301, ', 'Exam 3F/ ALTAM/ FAP modules: ACTS 6302', 'Exam 4/ FAM/ASTAM: ACTS 6304, , ', 'Exam SRM: ACTS 6307', 'Exam PA: ACTS 6310', 'Mathematical Statistics: STAT 5352, ', 'Accounting and Finance: FIN 6301, , ', 'Economics: MECO 6303', 'BMEN 6374 Genes, Proteins and Cell Biology for Engineers', 'BIOL 6V00 Topics in Biological Sciences (Computational Molecular Evolution)', 'CS 5303 Computer Science I', 'MATH 5303 Advanced Calculus and Linear Algebra', 'STAT 5351 Probability and Statistics I (for Elective Group 2)', 'or STAT 5353 Probability and Statistics for Data Science and Bioinformatics (for Elective Groups 1 and 3)', 'CS 5343 Algorithm Analysis and Data Structures', 'MATH 6312 Combinatorics and Graph Theory', 'MATH 6341 Bioinformatics', 'or BIOL 5376 Applied Bioinformatics', 'MATH 6346 Medical Image Analysis', 'CS 6307 Introduction to Big Data Management and Analytics for non CS-Majors', 'CS 6314 Web Programming Languages', 'CS 6360 Database Design', 'CS 6375 Machine Learning', 'STAT 5352 Probability and Statistics II', 'STAT 6337 Advanced Statistical Methods I', 'STAT 6338 Advanced Statistical Methods II', 'STAT 6340 Statistical and Machine Learning', 'MATH 6341 Bioinformatics', 'or BIOL 5376 Applied Bioinformatics', 'MATH 6346 Medical Image Analysis', 'MATH 6341 Bioinformatics', 'or BIOL 5376 Applied Bioinformatics', 'MATH 6345 Mathematical Methods in Medicine and Biology', 'MATH 6346 Medical Image Analysis', 'BIOL 5375 Genes to Genomes', 'BIOL 5381 Genomics', 'BIOL 6315 Epigenetics', 'BIOL 6373 Proteomics', 'BIOL 6385 Computational Biology', 'or BMEN 6389 Computational Biology', 'or MATH 6343 Computational Biology', 'BIOL 5410 Biochemistry', 'BIOL 5420 Molecular Biology', 'STAT 5351 Probability and Statistics I (for Elective Group 2)', 'or STAT 5353 Probability and Statistics for Data Science and Bioinformatics (for Elective Groups 1 and 3)', 'MATH 5303 Advanced Calculus and Linear Algebra', 'CS 5303 Computer Science I', 'CS 5343 Algorithm Analysis and Data Structures', 'MATH 6312 Combinatorics and Graph Theory', 'MATH 6341 Bioinformatics', 'or BIOL 5376 Applied Bioinformatics', 'MATH 6346 Medical Image Analysis', 'CS 6307 Introduction to Big Data Management and Analytics for non CS-Majors', 'CS 6314 Web Programming Languages', 'CS 6360 Database Design', 'CS 6375 Machine Learning', 'STAT 5352 Probability and Statistics II', 'STAT 6337 Advanced Statistical Methods I', 'STAT 6338 Advanced Statistical Methods II', 'STAT 6340 Statistical and Machine Learning', 'MATH 6341 Bioinformatics', 'or BIOL 5376 Applied Bioinformatics', 'MATH 6346 Medical Image Analysis', 'MATH 6341 Bioinformatics', 'or BIOL 5376 Applied Bioinformatics', 'MATH 6346 Medical Image Analysis', 'MATH 6345 Mathematical Methods in Medicine and Biology', 'BIOL 5375 Genes to Genomes', 'BIOL 5381 Genomics', 'BIOL 6315 Epigenetics', 'BIOL 6373 Proteomics', 'BIOL 6385 Computational Biology', 'or BMEN 6389 Computational Biology', 'or MATH 6343 Computational Biology', 'BIOL 6V00 Topics in Biological Sciences (Computational Molecular Evolution)', 'BIOL 6V00 Topics in Biological Sciences (Introduction to Programming for Biological Sciences)', ""For a PhD bound student in the Department of Biological Sciences, BIOL 5440 Cell Biology and  Quantitative Biology (or an equivalent) are required. This requirement can be fulfilled by taking these courses as 'electives' in the Bioinformatics and Computational Biology program."", 'MATH 6301 Real Analysis', 'MATH 6302 Functional Analysis I', 'MATH 6303 Theory of Complex Functions I', 'MATH 6311 Abstract Algebra I', 'MATH 6315 Ordinary Differential Equations', 'MATH 6309 Differential Geometry', 'MATH 6310 Topology', 'MATH 6312 Combinatorics and Graph Theory', 'MATH 6313 Numerical Analysis', 'MATH 6316 Differential Equations', 'MATH 6318 Numerical Analysis of Differential Equations', 'MATH 6319 Principles and Techniques in Applied Mathematics I', 'MATH 6320 Principles and Techniques in Applied Mathematics II', 'MATH 6321 Optimization', 'MATH 6325 Nonlinear Analysis I', 'MATH 6340 Numerical Linear Algebra', 'MATH 6342 Scientific Computing', 'MATH 7313 Partial Differential Equations I', 'MATH 7319 Functional Analysis II', 'MATH 7361 Algebraic Geometry and Non-linear Equations', 'STAT 6331 Statistical Inference I', 'STAT 6332 Statistical Inference II', 'STAT 6337 Advanced Statistical Methods I', 'STAT 6338 Advanced Statistical Methods II', 'STAT 6339 Linear Statistical Models', 'STAT 6344 Probability Theory I', 'STAT 7330 Bayesian Data Analysis', 'STAT 7331 Multivariate Analysis', 'STAT 7334 Nonparametric and Robust Statistical Methods', 'STAT 7336 Nonparametric Curve Estimation', 'STAT 7338 Time Series Modeling and Filtering', 'STAT 7339 Advanced Regression Modeling', 'STAT 7340 Functional Data Analysis', 'STAT 7345 Advanced Probability and Stochastic Processes', 'CS 6307 Introduction to Big Data Management and Analytics for non CS-Majors', 'CS 6375 Machine Learning', 'MATH 6312 Combinatorics and Graph Theory', 'STAT 6340 Statistical and Machine Learning']"
https://www.utdallas.edu/fact-sheets/bbs/msf-applied-cognition-and-neuroscience/,bbs,Master of Science in Applied Cognition and Neuroscience,https://catalog.utdallas.edu/now/graduate/programs/bbs/applied-cognition-and-neuroscience,"['ACN 6330 Cognitive Science', 'ACN 6331 Cognitive Development', 'ACN 6332 Perception', 'ACN 6333 Memory', 'ACN 6334 Attention', 'ACN 6338 Functional Neuroanatomy', 'ACN 6340 Cellular Neuroscience', 'ACN 6341 Foundations of Human-Computer Interaction', 'ACN 6346 Systems Neuroscience', 'ACN 6348 Neural Net Mathematics', 'ACN 6367 Speech Perception', 'ACN 6395 Cognitive Psychology', 'ACN 7343 Neuropharmacology', 'ACN 6345 Neurobiology of Learning and Memory', 'ACN 6323 Neurophysiology', 'ACN 5314 Computational Modeling Methods in Behavioral and Brain Sciences', 'ACN 6310 Fundamentals of Functional Brain Imaging', 'ACN 6312 Research Methods in Behavioral and Brain Sciences - Part I', 'ACN 6313 Research Methods in Behavioral and Brain Sciences - Part II', 'ACN 6337 Cognitive Ethnography', 'ACN 6342 Applied Human-Computer Interaction', 'ACN 6344 Human-Computer Interaction Lab', 'ACN 6349 Statistical Machine Learning', 'ACN 6373 Intraoperative Neurophysiological Monitoring (IONM) Part I', 'ACN 6374 Intraoperative Neurophysiological Monitoring (IONM) Part II', 'ACN 6375 IONM Special Topics', 'ACN 6388 MATLAB for Brain Sciences', 'ACN 6389 Speech Perception Laboratory', 'ACN 7320 Topics in Multivariate Data Analysis using R', 'ACN 7321 Topics in Multivariate Data Analysis Theory', 'HCS 6341 Genes, Brain, and Behavior', 'HCS 6315 Scientific and Grant Writing', 'ACN 6V71 Industry Internship', 'ACN 6V72 Research Internship', 'HCS 8V87 Research in Psychology', 'HCS 8V88 Research in Speech, Language, and Hearing Sciences', 'HCS 8V89 Research in Neuroscience\\', 'ACN 6V91 Thesis in Applied Cognition and Neuroscience', 'Core Courses: ACN 6346 Systems Neuroscience,  Functional Neuroanatomy,  Cellular Neuroscience,  Neuropharmacology,  Neurophysiology, and  Cognitive Psychology. The courses , , , and  are strongly recommended for students in this specialization area.', 'Methods Courses: ACN 6312 Research Methods in Behavioral and Brain Sciences - Part I,  Research Methods in Behavioral and Brain Sciences - Part II,  Advanced Research Methods,  Intraoperative Neurophysiological Monitoring (IONM) Part I,  Intraoperative Neurophysiological Monitoring (IONM) Part II,  Genes, Brain, and Behavior,  MATLAB for Brain Sciences, and  IONM Special Topics.', 'Specialization Area Electives: ACN 6310 Fundamentals of Functional Brain Imaging, and  Neurobiology of Learning and Memory. Students interested in a cognitive-neuroscience focus should take  Cognitive Psychology and at least one of the following courses:  Cognitive Science,  Cognitive Development,  Memory,  Speech Perception,  Perception, and  Attention.', 'Core Courses: ACN 6346 Systems Neuroscience,  Functional Neuroanatomy,  Cellular Neuroscience,  Neurophysiology,  Neurobiology of Learning and Memory,  Cognitive Science,  Cognitive Psychology,  Cognitive Development,  Memory,  Speech Perception,  Perception, and  Attention.', 'Methods Courses: ACN 6312 Research Methods in Behavioral and Brain Sciences - Part I,  Research Methods in Behavioral and Brain Sciences - Part II.', 'Core Courses: Choose two of the following: ACN 6395 Cognitive Psychology, and  Foundations of Human-Computer Interaction. It is strongly recommended that one of the two core courses should be  Foundations of Human-Computer Interaction.', 'Methods Courses: ACN 6312 Research Methods in Behavioral and Brain Sciences - Part I,  Research Methods in Behavioral and Brain Sciences - Part II,  Speech Perception Laboratory,  Cognitive Ethnography,  Applied Human-Computer Interaction, and  Human-Computer Interaction Lab. It is strongly recommended that students in this specialization area take: , , and .', 'Specialization Area Electives: For students interested in careers in HCI usability engineering, the recommended courses are the core courses and specialization area electives from the Neuroscience and Cognition and Neuroscience Specialization areas. In addition, it is strongly recommended that students take at least one of the following courses: ACN 6332 Perception,  Memory,  Attention, and  Speech Perception. Students with computer science backgrounds should consider taking the course sequence:  Algorithm Analysis and Data Structures followed by  Human Computer Interactions. Students interested in the design aspects of HCI should consider taking one or more Arts Technology Communication and Media (ATCM) graduate courses in order to satisfy some of the HCI specialization area elective requirements. ', 'Students choosing the computational modeling/intelligent systems specialization area are expected to focus on developing their computer programming skills through both coursework and extracurricular activities. In addition, note the prerequisites for ACN 6348 Neural Net Mathematics are lower-division linear algebra, lower-division calculus, and an upper-division calculus-based probability theory course.', 'Core Courses: It is strongly recommended that students in this specialization area select ACN 6348 Neural Net Mathematics as one of the two core courses. The other core course should be chosen from the following list:  Systems Neuroscience,  Cognitive Psychology,  Cognitive Science,  Neurophysiology, and  Functional Neuroanatomy.', 'Methods Courses: It is strongly recommended that students in this specialization area select ACN 5314 Computational Modeling Methods in Behavioral and Brain Sciences as one of the two methods courses. The other methods course should be chosen from the following list:  Statistical Machine Learning,  Topics in Multivariate Data Analysis Theory in conjunction with  Topics in Multivariate Data Analysis using R,  Research Methods in Behavioral and Brain Sciences - Part II. Students choosing the Computational Modeling/Intelligent Systems specialization area should not take the introductory courses:  Research Methods in Behavioral and Brain Sciences - Part I and  MATLAB for Brain Sciences.', 'Students with backgrounds in computer science should consider taking the graduate courses: CS 5343 Algorithm Analysis and Data Structures,  Natural Language Processing,  Discourse Processing,  Artificial Intelligence,  Intelligent Systems,  Machine Learning, and  Computer Vision. ', 'In addition, the following courses in Data Analytics are recommended: EPPS 6323 Knowledge Mining,  Data Visualization,  Bayesian Analysis for Social and Behavioral Sciences, and  Data Management for Social Science Research.', 'Core Courses: Choose two of the following: ACN 6338 Functional Neuroanatomy,  Systems Neuroscience,  Neurophysiology, and  Cellular Neuroscience. It is strongly recommended that all IONM students take  and  and if possible should also take .', 'Methods Courses: Choose two of the following: ACN 6373 Intraoperative Neurophysiological Monitoring (IONM) Part I,  Intraoperative Neurophysiological Monitoring (IONM) Part II, and  IONM Special Topics.', 'Specialization Area Electives: ACN 6310 Fundamentals of Functional Brain Imaging,  The Neuroscience of Pain,  Neurobiology of Learning and Memory,  Genes, Brain, and Behavior, and  Neuroplasticity and Disorders of the Nervous System.']"
https://www.utdallas.edu/fact-sheets/epps/ms-applied-sociology/,epps,Master of Science in Applied Sociology,https://catalog.utdallas.edu/now/graduate/programs/epps/sociology#applied-sociology-ms,"['EPPS 6313 Introduction to Quantitative Methods', 'SOC 6350 Social Stratification', 'EPPS 6352 Evaluation Research Methods in the Economic, Political and Policy Sciences', 'PA 7330 Research Design in Public Affairs', 'PPPE 6310 Research Design I', 'SOC 6315 Evaluating Program and Organizational Performance', 'EPPS 6316 Applied Regression', 'EPPS 6346 Qualitative Research Orientation', 'SOC 6340 Domestic Social Policy', 'SOC 6312 Social-Economic Theories', 'SOC 5V92 Internship in Applied Sociology', 'SOC 6V92 Research Workshop in Applied Sociology']"
https://www.utdallas.edu/fact-sheets/ah/ma-art-history/,ah,Master of Arts in Art History,https://catalog.utdallas.edu/now/graduate/programs/ah/art-history,"['AHST 6301 Foundations I: Practices of Art History', 'AHST 6302 Foundations II: History of Materials and Techniques', 'AHST 6310 Topics in Art History', 'AHST 6311 Topics in Architecture and Landscape Architecture', 'AHST 6312 Topics in Sculpture', 'AHST 6313 Topics in Painting', 'AHST 6314 Topics in Works on Paper', 'AHST 6315 Topics in the History of Design', 'AHST 6316 Topics in Decorative Arts', 'AHST 6317 Topics in the History of New Media', 'AHST 6320 Topics in the History of Collecting', 'AHST 6321 Topics in Global Art Histories', 'AHST 6322 Topics in Data-Driven Art History', 'AHST 6323 Topics in the Histories of Art and Science', 'AHST 6V99 Practicum']"
https://www.utdallas.edu/fact-sheets/atec/ma-atec/,atec,"Master of Arts in Arts, Technology, and Emerging Communication",https://catalog.utdallas.edu/now/graduate/programs/atec/arts-technology-and-emerging-communication-ma,"['ATCM 6000 ATEC Colloquium', 'ATCM 6300 Approaches to Arts, Technology, and Emerging Communication', 'ATCM 6375 Critical Approaches to Emerging Media Studies', 'ATCM 6376 Media and Cultural Studies Methods', 'Students are expected to complete ATCM 6300 in their first semester and the remainder of these courses within the first 18 semester credit hours in their degree plan.', 'ATCM 6301 Aesthetics of Interactive Arts', 'ATCM 6336 Critical Game Studies', 'ATCM 6345 Interactive Narrative', 'ATCM 6351 History and Culture of Games', 'ATCM 6352 Socially Conscious Games', 'ATCM 6354 Play and Culture', 'ATCM 6357 Virtual Worlds and Communities', 'ATCM 6377 Creativity as Social Practice', 'ATCM 6381 Media, Culture, and Economy', 'ATCM 6382 Privacy, Surveillance, and Technology', 'ATCM 6383 Digital Culture', 'ATCM 6384 Digital Publics and Counterpublics', 'ATCM 6385 Emerging Media and Identity', 'ATCM 6386 Digital Textuality', 'ATCM 6387 Emerging Media Studio', 'ATCM 6388 Critical Making', 'ATCM 6389 Special Topics in Networked Cultures', ""ATCM 6399 Master's Thesis"", 'ATCM 6000 ATEC Colloquium', 'ATCM 6300 Approaches to Arts, Technology, and Emerging Communication', 'ATCM 6302 Theories and Histories of Semiotics', 'ATCM 6361 Design Research Methods', 'Students are expected to complete ATCM 6300 in their first semester and the remainder of these courses within the first 18 semester credit hours in their degree plan.', 'ATCM 6301 Aesthetics of Interactive Arts', 'ATCM 6304 Computer Processing for Arts, Technology, and Emerging Communication', 'ATCM 6322 Experimental Interactive Media', 'ATCM 6326 Research in Sound Design', 'ATCM 6345 Interactive Narrative', 'ATCM 6360 History of Interactive Media', 'ATCM 6365 Design Principles', 'ATCM 6366 Information Architecture and Design', 'ATCM 6367 Human Computer Interaction', 'ATCM 6368 Usability Testing', 'ATCM 6369 Media Analytics', 'ATCM 6370 Computational Design', 'ATCM 6371 Visualization Research', 'ATCM 6372 Pervasive Computing and Interaction Design', 'ATCM 6373 Interactive Environments', 'ATCM 6374 Special Topics in Interaction Design', 'ATCM 6375 Critical Approaches to Emerging Media Studies', 'ATCM 6377 Creativity as Social Practice', 'ATCM 6380 Histories of Emerging Media', 'ATCM 6381 Media, Culture, and Economy', 'ATCM 6383 Digital Culture', 'ATCM 6384 Digital Publics and Counterpublics', 'ATCM 6387 Emerging Media Studio', 'ATCM 6390 Social Science Research Methods in Emerging Communication', 'ATCM 6391 Theories of Media Psychology', ""ATCM 6399 Master's Thesis"", 'Students who have not previously completed six semester credit hours of coursework in computer programming are required to complete ATCM 6304.', 'ATCM 6000 ATEC Colloquium', 'ATCM 6300 Approaches to Arts, Technology, and Emerging Communication', 'ATCM 6301 Aesthetics of Interactive Arts', 'ATCM 7331 Research Methodology in Arts, Technology, and Emerging Communication', 'Students are expected to complete ATCM 6300 in their first semester and the remainder of these courses within the first 18 semester credit hours in their degree plan.', 'ATCM 6361 Design Research Methods', 'ATCM 6376 Media and Cultural Studies Methods', 'ATCM 6390 Social Science Research Methods in Emerging Communication', 'ATCM 7332 Creative Practice Research Methods', 'ATCM 6304 Computer Processing for Arts, Technology, and Emerging Communication', 'ATCM 6326 Research in Sound Design', 'ATCM 6352 Socially Conscious Games', 'ATCM 6366 Information Architecture and Design', 'ATCM 6371 Visualization Research', 'ATCM 6375 Critical Approaches to Emerging Media Studies', 'ATCM 6377 Creativity as Social Practice', 'ATCM 6386 Digital Textuality', 'ATCM 6387 Emerging Media Studio', 'ATCM 6388 Critical Making', 'ATCM 6322 Experimental Interactive Media', 'ATCM 6335 Game Design and Development', 'ATCM 6371 Visualization Research', 'ATCM 6383 Digital Culture', 'ATCM 6386 Digital Textuality', 'ATCM 6389 Special Topics in Networked Cultures', 'ATCM 6390 Social Science Research Methods in Emerging Communication', 'ATCM 6395 Special Topics in Arts, Technology, and Emerging Communication', 'ATCM 7340 Advanced Studies in Arts, Technology, and Emerging Communication', 'ATCM 7390 Advanced Special Topics in Arts, Technology, and Emerging Communication', 'ATCM 7620 Advanced Projects in Simulation and Game Design', 'ATCM 7V81 Advanced Doctoral Project Workshop', 'ATCM 7V82 Advanced Projects in Interactive Media']"
