URL Links,Department Initials,Title,Catalog Page,Courses
https://www.utdallas.edu/fact-sheets/is/ba-american-studies/,is,Bachelor of Arts in American Studies,https://catalog.utdallas.edu/now/undergraduate/programs/is/american-studies,"['COMM 1311 Survey of Oral and Technology-based Communication', 'RHET 1302 Rhetoric', 'MATH 1306 College Algebra for the Non-Scientist', 'MATH 1314 College Algebra', 'AMS 2300 American Popular Culture', 'AMS 2341 American Studies for the Twenty-First Century', 'HUMA 1301 Exploration of the Humanities', 'ARTS 1301 Exploration of the Arts', 'FILM 2332 Understanding Film', 'HIST 1301 U.S. History Survey to Civil War', 'HIST 1302 U.S. History Survey from Civil War', 'HIST 2301 History of Texas', 'GOVT 2305 American National Government', 'GOVT 2306 State and Local Government', 'GST 2300 Introduction to Gender Studies', 'PSY 2301 Introduction to Psychology', 'SOC 1301 Introduction to Sociology', 'AMS 3327 American Studies: Histories, Theories, Methodologies', 'AMS 2341 American Studies for the Twenty-First Century', 'or AMS 2300 American Popular Culture', 'AMS 3302 American Cultures', 'BIS 3320 The Nature of Intellectual Inquiry', 'MATH 1306 College Algebra for the Non-Scientist', 'or MATH 1314 College Algebra', 'UNIV 1010 Comets to the Core Pre-Assessment', 'BIS 1100 Interdisciplinary Studies Freshman Seminar']"
https://www.utdallas.edu/fact-sheets/is/bs-healthcare-studies/,is,Bachelor of Science in Healthcare Studies,https://catalog.utdallas.edu/now/undergraduate/programs/is/healthcare,"['COMM 1311 Survey of Oral and Technology-based Communication', 'RHET 1302 Rhetoric', 'MATH 1325 Applied Calculus I', 'MATH 2413 Differential Calculus', 'CHEM 1311 General Chemistry I', 'CHEM 1312 General Chemistry II', 'ARTS 1301 Exploration of the Arts', 'GOVT 2305 American National Government', 'GOVT 2306 State and Local Government', 'PSY 2301 Introduction to Psychology', 'BIOL 2311 Introduction to Modern Biology I', 'STAT 2332 Introductory Statistics for Life Sciences', 'or STAT 1342 Statistical Decision Making', 'BIOL 2311 Introduction to Modern Biology I', 'BIOL 2111 Introduction to Modern Biology Workshop I', 'BIOL 2312 Introduction to Modern Biology II', 'BIOL 2112 Introduction to Modern Biology Workshop II', 'CHEM 1311 General Chemistry I', 'CHEM 1111 General Chemistry Laboratory I', 'CHEM 1312 General Chemistry II', 'CHEM 1112 General Chemistry Laboratory II', 'MATH 1325 Applied Calculus I', 'or MATH 2413 Differential Calculus', 'CHEM 2323 Introductory Organic Chemistry I', 'CHEM 2123 Introductory Organic Chemistry Laboratory I', 'CHEM 2325 Introductory Organic Chemistry II', 'CHEM 2125 Introductory Organic Chemistry Laboratory II', 'PHYS 1301 College Physics I', 'PHYS 2125 Physics Laboratory I', 'PHYS 1302 College Physics II', 'PHYS 2126 Physics Laboratory II', 'CHEM 2323 Introductory Organic Chemistry I', 'CHEM 2123 Introductory Organic Chemistry Laboratory I', 'CHEM 2325 Introductory Organic Chemistry II', 'CHEM 2125 Introductory Organic Chemistry Laboratory II', 'PHYS 1301 College Physics I', 'or PHYS 2325 Mechanics', 'PHYS 2125 Physics Laboratory I', 'PHYS 1302 College Physics II', 'or PHYS 2326 Electromagnetism and Waves', 'PHYS 2126 Physics Laboratory II', 'HLTH 1100 Career Explorations for the Health Professions', 'HLTH 3101 Medical Terminology', 'HLTH 3300 Pre-Health Professional Development', 'HLTH 3305 The U.S. Healthcare System', 'HLTH 3315 Issues in Patient Education', 'HLTH 4304 Health Professions Internship', 'BIS 3320 The Nature of Intellectual Inquiry', 'HLTH 3301 Issues in Geriatric Healthcare', 'HLTH 4305 Public Health', 'HLTH 4380 Special Topics in Healthcare', 'PSY 4328 Health Psychology', 'PSY 4343 Abnormal Psychology', 'ECON 3330 Economics of Health', 'GEOG 3357 Spatial Dimensions of Health and Disease', 'HLTH 3310 Health Care Issues: Global Perspectives', 'HMGT 3301 Introduction to Healthcare Management', 'HLTH 3306 Gender in Healthcare', 'PHIL 3328 History and Philosophy of Science and Medicine', 'PHIL 3320 Medical Ethics', 'PHIL 4321 Philosophy of Medicine', 'SOC 4371 Mental Health and Illness', 'SOC 4372 Health and Illness', 'UNIV 1010 Freshman Seminar', 'BIS 1100 Interdisciplinary Studies Freshman Seminar', 'BIOL 2281 Introductory Biology Laboratory', 'BIOL 3301 Classical and Molecular Genetics', 'BIOL 3101 Classical and Molecular Genetics Workshop', 'BIOL 3302 Eukaryotic Molecular and Cell Biology', 'BIOL 3102 Eukaryotic Molecular and Cell Biology Workshop', 'BIOL 3361 or  Biochemistry I', 'BIOL 3161 Biochemistry Workshop I', 'BIOL 3362 or  Biochemistry II', 'BIOL 3162 Biochemistry Workshop II', 'BIOL 3455 Human Anatomy and Physiology with Lab I', 'BIOL 3456 Human Anatomy and Physiology with Lab II', 'BIOL 3520 General Microbiology with Lab', 'BIOL 3370 Exercise Physiology', 'BIOL 4310 Cellular Microbiology', 'BIOL 4345 Immunobiology', 'BIOL 4350 Medical Microbiology', 'BIOL 4V40 Special Topics in Molecular and Cell Biology', 'HLTH 1301 Introduction to Kinesiology', 'HLTH 1322 Human Nutrition', 'HLTH 3306 Gender in Healthcare', 'HLTH 4306 Health and Sport', 'HLTH 4307 Climate Change in Healthcare', 'HLTH 4V01 Health Professions Independent Study', 'ISIS 3309 Dental Anthropology', 'ISIS 4V89 Special Topics in Interdisciplinary Studies', 'NSC 3361 Introduction to Neuroscience', 'NSC 4366 Neuroanatomy', 'NSC 4351 Medical Neuroscience']"
https://www.utdallas.edu/fact-sheets/is/ba-bs-interdisciplinary-studies/,is,Bachelor of Arts and Bachelor of Science in Interdisciplinary Studies,https://catalog.utdallas.edu/now/undergraduate/programs/is/interdisciplinary-studies,"['COMM 1311 Survey of Oral and Technology-based Communication', 'RHET 1302 Rhetoric', 'MATH 1306 College Algebra for the Non-Scientist', 'MATH 1314 College Algebra', 'ISNS 2359 Earthquakes and Volcanoes', 'ISNS 2367 The Oceans', 'ISNS 2368 Weather and Climate', 'AMS 2300 American Popular Culture', 'AMS 2341 American Studies for the Twenty-First Century', 'HUMA 1301 Exploration of the Humanities', 'ARTS 1301 Exploration of the Arts', 'GOVT 2305 American National Government', 'GOVT 2306 State and Local Government', 'GST 2300 Introduction to Gender Studies', 'PSY 2301 Introduction to Psychology', 'SOC 1301 Introduction to Sociology', 'MATH 1306 College Algebra for the Non-Scientist', 'or MATH 1314 College Algebra', 'BIS 3320 The Nature of Intellectual Inquiry', 'Two 3 semester credit hour courses chosen from AMS, GST, or ISIS, or BIS 4V04 Internship', 'UNIV 1010 Comets to the Core Pre-Assessment', 'BIS 1100 Interdisciplinary Studies Freshman Seminar', 'BIS 3320 The Nature of Intellectual Inquiry (3 semester credit hours)', 'COMM 1311 Survey of Oral and Technology-based Communication', 'RHET 1302 Rhetoric', 'MATH 1325 Applied Calculus I', 'MATH 2413 Differential Calculus', 'MATH 2417 Calculus I', 'ISNS 2359 Earthquakes and Volcanoes', 'ISNS 2367 The Oceans', 'ISNS 2368 Weather and Climate', 'AMS 2300 American Popular Culture', 'AMS 2341 American Studies for the Twenty-First Century', 'HUMA 1301 Exploration of the Humanities', 'ARTS 1301 Exploration of the Arts', 'GOVT 2305 American National Government', 'GOVT 2306 State and Local Government', 'GST 2300 Introduction to Gender Studies', 'PSY 2301 Introduction to Psychology', 'SOC 1301 Introduction to Sociology', 'MATH 1326 Applied Calculus II (if  Applied Calculus I is taken)', 'MATH 2414 Integral Calculus ', 'or MATH 2415 Calculus of Several Variables (if  Differential Calculus is taken)', 'MATH 2419 Calculus II (if  Calculus I is taken)', 'and MATH 2415 Calculus of Several Variables', 'BIS 3320 The Nature of Intellectual Inquiry', 'One 3 semester credit hour  AMS, GST, or ISIS, or BIS 4V04 Internship', 'UNIV 1010 Comets to the Core Pre-Assessment', 'BIS 1100 Interdisciplinary Studies Freshman Seminar', 'BIS 3320 The Nature of Intellectual Inquiry (3 semester credit hours)']"
https://www.utdallas.edu/fact-sheets/atec/ba-arts-technology-and-emerging-communication/,atec,"Bachelor of Arts in Arts, Technology, and Emerging Communication",https://catalog.utdallas.edu/now/undergraduate/programs/atec,[]
https://www.utdallas.edu/fact-sheets/bbs/bs-cognitive-science/,bbs,Bachelor of Science in Cognitive Science,https://catalog.utdallas.edu/2018/undergraduate/programs/bbs/cognitive-science,"['COMM 1311 Survey of Oral and Technology-based Communication', 'RHET 1302 Rhetoric', 'MATH 2417 Calculus I or  Differential Calculus (Note:  is recommended)', 'HUMA 1301 Exploration of the Humanities', 'LIT 2331 Masterpieces of World Literature', 'PHIL 1301 Introduction to Philosophy', 'PHIL 2316 History of Philosophy I', 'PHIL 2317 History of Philosophy II', 'AHST 1303 Survey of Western Art History: Ancient to Medieval', 'AHST 1304 Survey of Western Art History: Renaissance to Modern', 'AHST 2331 Understanding Art', 'ARTS 1301 Exploration of the Arts', 'DANC 1310 Understanding Dance', 'THEA 1310 Understanding Theater', 'FILM 2332 Understanding Film', 'MUSI 1306 Understanding Music', 'HIST 1301 U.S. History Survey to Civil War', 'HIST 1302 U.S. History Survey from Civil War', 'HIST 2301 History of Texas', 'HIST 2330 Themes and Ideas in American History', 'HIST 2332 Civil War and Reconstruction', 'GOVT 2305 American National Government', 'GOVT 2306 State and Local Government', 'PSY 2301 Introduction to Psychology', 'MATH 2419 Calculus II or  Integral Calculus (Note:  is recommended)', 'CGS 2301 Cognitive Science', 'CGS 2301 Cognitive Science', 'CS 1337 Computer Science I', 'MATH 2417 Calculus I or  Differential Calculus', 'MATH 2419 Calculus II or  Integral Calculus', 'MATH 2418 Linear Algebra', 'PSY 2301 Introduction to Psychology', 'PSY 2317 Statistics for Psychology', 'or CS 3341 Probability and Statistics in Computer Science and Software Engineering', 'CS 2305 Discrete Mathematics for Computing I', 'CS 2336 Computer Science II', 'CGS 3361 Cognitive Psychology', 'NSC 3361 Introduction to Neuroscience', 'PSY 3392 Research Design and Analysis', 'CGS 3340 Experimental Projects in Cognitive Science', 'or PSY 3393 Experimental Projects in Psychology', 'CGS 3325 Historical Perspectives on Psychology: Mind and Machines since 1600', 'CGS 4359 Cognitive Neuroscience', 'CGS 4362 Perception', 'CGS 4352 Human Computer Interactions I', 'CGS 4353 Human Computer Interactions II', 'PSY 3331 Social Psychology', 'PSY 4343 Abnormal Psychology', 'PSY 2314 Lifespan Development', 'PSY 3310 Child Development', 'PSY 3362 Cognitive Development', 'NSC 4352 Cellular Neuroscience', 'NSC 4354 Integrative Neuroscience', 'NSC 4356 Neurophysiology', 'NSC 4366 Neuroanatomy', 'NSC 4363 Neuropharmacology', 'NSC 4367 Developmental Neurobiology', 'NSC 4359 Cognitive Neuroscience', 'NSC 4353 Neuroscience Laboratory Methods', 'NSC 4357 Neurobiology of Learning and Memory', 'NSC 4362 Molecular Neuroscience', 'NSC 4371 Neural Plasticity', 'NSC 4373 Sensory Neuroscience', 'NSC 4385 Neuropsychology', 'CS 3341 Probability and Statistics in Computer Science and Software Engineering', 'CGS 3342 Cognitive and Neural Modeling Laboratory', 'CGS 4312 Computational Modeling Methods for Language Understanding', 'CGS 4313 Neural Net Mathematics', 'CGS 4314 Intelligent Systems Analysis', 'CGS 4315 Intelligent Systems Design', 'CS 3345 Data Structures and Introduction to Algorithmic Analysis', 'CS 4365 Artificial Intelligence', 'CS 4375 Introduction to Machine Learning', 'CS 4391 Introduction to Computer Vision', 'CS 4395 Human Language Technologies', 'Incoming freshmen must enroll and complete requirements of BBSU 1100.']"
https://www.utdallas.edu/fact-sheets/bbs/bs-child-learning-and-development/,bbs,Bachelor of Science in Child Learning and Development,https://catalog.utdallas.edu/2018/undergraduate/programs/bbs/child-learning-and-development,"['COMM 1311 Survey of Oral and Technology-based Communication', 'RHET 1302 Rhetoric', 'MATH 1306 College Algebra for the Non-Scientist', 'MATH 1314 College Algebra', 'or MATH 2417 Calculus I', 'HUMA 1301 Exploration of the Humanities', 'LIT 2331 Masterpieces of World Literature', 'PHIL 1301 Introduction to Philosophy', 'PHIL 2316 History of Philosophy I', 'PHIL 2317 History of Philosophy II', 'ARTS 1301 Exploration of the Arts', 'AHST 1303 Survey of Western Art History: Ancient to Medieval', 'AHST 1304 Survey of Western Art History: Renaissance to Modern', 'AHST 2331 Understanding Art', 'DANC 1310 Understanding Dance', 'THEA 1310 Understanding Theater', 'FILM 2332 Understanding Film', 'MUSI 1306 Understanding Music', 'HIST 1301 U.S. History Survey to Civil War', 'HIST 1302 U.S. History Survey from Civil War', 'HIST 2301 History of Texas', 'HIST 2330 Themes and Ideas in American History', 'HIST 2332 Civil War and Reconstruction', 'GOVT 2305 American National Government', 'GOVT 2306 State and Local Government', 'PSY 2301 Introduction to Psychology', 'PSY 2317 Statistics for Psychology', 'or STAT 1342 Statistical Decision Making', 'or STAT 2332 Introductory Statistics for Life Sciences', 'PSY 2314 Lifespan Development', 'PSY 2364 Animal Communication', 'CGS 2301 Cognitive Science', 'PSY 2301 Introduction to Psychology', 'PSY 2317 Statistics for Psychology', 'or STAT 1342 Statistical Decision Making', 'or STAT 2332 Introductory Statistics for Life Sciences', 'CLDP 3303 Normal Language Development', 'or CLDP 3305 Language and Literacy Development', 'CLDP 3310 Child Development', 'or CLDP 3339 Educational Psychology', 'CLDP 3332 Social and Personality Development', 'CLDP 3342 Exceptional Children', 'or CLDP 4344 Child Psychopathology', 'CLDP 3362 Cognitive Development', 'or CLDP 3365 Child Learning', 'PSY 3392 Research Design and Analysis', 'CLDP 3394 Research and Evaluation Methods', 'CLDP 4394 Internship', 'or BBSU 3310 Community-Based Service Learning', 'or CLDP 4395 Co-op Fieldwork', 'or CLDP 4397 Thesis Research (Honors Thesis)', 'or CLDP 4V96 Teaching Internship', 'or CLDP 4V98 Directed Research', 'or CLDP 4V99 Individual Study', 'Plus 12 semester credit hours of courses with CLDP prefix or any of the following courses: CGS 3342, , , , , , , , , , , , , , , , , , , , , , , , , , , , ,  or .', 'Incoming freshmen must enroll and complete requirements of BBSU 1100.', 'PSY 3310 Child Development', 'or PSY 3339 Educational Psychology', 'PSY 3332 Social and Personality Development', 'PSY 3362 Cognitive Development', 'PSY 3342 Exceptional Children', 'PSY 4344 Child Psychopathology', 'PSY 4373 Psychological Assessment', 'PSY 4394 Internship in Psychology', 'or ED 4693 Student Teaching - Elementary (approval of the Teacher Development Center required)', 'SPAU 3303 Normal Language Development', 'SPAU 3305 Language and Literacy Development', 'SPAU 4308 Language Disorders in Children']"
https://www.utdallas.edu/fact-sheets/jsom/bs-information-technology-and-systems/,jsom,Bachelor of Science in Information Technology and Systems,https://catalog.utdallas.edu/now/undergraduate/programs/jsom/information-technology-systems,"['MATH 1325 Applied Calculus I', 'GOVT 2305 American National Government', 'GOVT 2306 State and Local Government', 'BA 1310 Making Choices in Free Market Systems', 'BA 1320 Business in a Global World', 'ECON 2301 Principles of Macroeconomics', 'ECON 2302 Principles of Microeconomics', 'MATH 1326 Applied Calculus II', 'BA 1310 Making Choices in Free Market Systems', 'BA 1320 Business in a Global World', 'ECON 2301 Principles of Macroeconomics', 'ECON 2302 Principles of Microeconomics', 'ACCT 2301 Introductory Financial Accounting', 'ACCT 2302 Introductory Management Accounting', 'BLAW 2301 Business and Public Law', 'MATH 1325 Applied Calculus I', 'MATH 1326 Applied Calculus II', 'or OPRE 3340 Advanced Business Quantitative Methods', 'OPRE 3333 Quantitative Business Analysis', 'or MATH 2333 Matrices, Vectors, and Their Application', 'OPRE 3360 Managerial Methods in Decision Making Under Uncertainty', 'or STAT 3360 Probability and Statistics for Management and Economics', 'ITSS 3311 Introduction to Programming', 'ITSS 3312 Object-Oriented Programming', 'or ITSS 4381 Object Oriented Programming with Python', 'BA 1310 Making Choices in Free Market Systems', 'BA 1320 Business in a Global World', 'ECON 2301 Principles of Macroeconomics', 'ECON 2302 Principles of Microeconomics', 'BCOM 1300 Introduction to Professionalism and Communication in Business', 'or BCOM 3300 Professionalism and Communication in Business', 'BCOM 4300 Managing Communications in Business', 'IMS 3310 International Business', 'FIN 3320 Business Finance', 'ITSS 3300 Information Technology for Business', 'OPRE 3310 Operations Management', 'OBHR 3310 Organizational Behavior', 'or OBHR 3330 Introduction to Human Resource Management', 'MKT 3300 Principles of Marketing', 'BA 4095 Social Sector Engagement and Community Outreach Practicum', 'ITSS 4300 Database Fundamentals', 'ITSS 4330 Systems Analysis and Design', 'ITSS 4360 Network and Information Security', 'ITSS 4351 Foundations of Business Intelligence', 'ITSS 4370 Information Technology Infrastructure', 'ITSS 4395 Capstone Senior Project - Information Systems', 'or BPS 4395 Capstone Senior Project - Business', 'ITSS 4090 Information Technology and Systems Internship', 'BA 4090 Management Internship', 'ITSS 4352 Introduction to Web Analytics', 'ITSS 4353 Business Analytics', 'ITSS 4354 Advanced Big Data Analytics', 'ITSS 4355 Data Visualization', 'ITSS 4340 Enterprise Resource Planning', 'ITSS 4343 Integrated SCM Information Systems', 'ITSS 4344 CRM using Salesforce', 'ACCT 4342 Analysis and Design of Accounting Systems', 'or ACCT 3322 Integrated Accounting Information Systems', 'ITSS 4340 Enterprise Resource Planning', 'MKT 3330 Introduction to Professional Selling', 'MKT 4331 Digital Prospecting', 'or MKT 4332 Advanced Professional Sales', 'Any ITSS upper-division course, excluding ITSS 4301 Database Systems, that is not part of the BS INTS major preparatory, major core, or major related courses.', 'ENTP 3301 Innovation and Entrepreneurship', 'ENTP 3320 Start-up Launch I', 'Any 2 ITSS upper-division courses, excluding ITSS 4301 Database Systems, that are not part of the BS INTS major preparatory, major core, or major related courses.', 'ITSS 4356 Data Governance', 'ITSS 4361 Information Technology Cybersecurity', 'ITSS 4362 Cybersecurity Governance', 'Any ITSS upper-division course, excluding ITSS 4301 Database Systems, that is not part of the BS INTS major preparatory, major core, or major related courses.', 'Any 12 SCH of ITSS upper-division courses, excluding ITSS 4301 Database Systems, that are not part of the BS INTS major preparatory, major core, or major related courses may be used to satisfy the 12 semester credit hours of guided elective credit.']"
https://www.utdallas.edu/fact-sheets/jsom/bs-global-business/,jsom,Bachelor of Science in Global Business,https://catalog.utdallas.edu/now/undergraduate/programs/jsom/global-business,"['MATH 1325 Applied Calculus I', 'GOVT 2305 American National Government', 'GOVT 2306 State and Local Government', 'BA 1310 Making Choices in Free Market Systems', 'BA 1320 Business in a Global World', 'ECON 2301 Principles of Macroeconomics', 'ECON 2302 Principles of Microeconomics', 'BA 1310 Making Choices in Free Market Systems', 'BA 1320 Business in a Global World', 'ECON 2301 Principles of Macroeconomics', 'ECON 2302 Principles of Microeconomics', 'ACCT 2301 Introductory Financial Accounting', 'ACCT 2302 Introductory Management Accounting', 'BLAW 2301 Business and Public Law', 'MATH 1325 Applied Calculus I', 'OPRE 3360 Managerial Methods in Decision Making Under Uncertainty', 'or STAT 3360 Probability and Statistics for Management and Economics', 'BA 1310 Making Choices in Free Market Systems', 'BA 1320 Business in a Global World', 'ECON 2301 Principles of Macroeconomics', 'ECON 2302 Principles of Microeconomics', 'BCOM 1300 Introduction to Professionalism and Communication in Business', 'or BCOM 3300 Professionalism and Communication in Business', 'BCOM 4300 Managing Communications in Business', 'IMS 3310 International Business', 'FIN 3320 Business Finance', 'ITSS 3300 Information Technology for Business', 'OPRE 3310 Operations Management', 'OBHR 3310 Organizational Behavior', 'or OBHR 3330 Introduction to Human Resource Management', 'MKT 3300 Principles of Marketing', 'IMS 4395 Capstone Senior Project - Global Business', 'or BPS 4395 Capstone Senior Project - Business', 'or ENTP 4395 Capstone Senior Project - Entrepreneurship', 'IMS 4320 or  International Marketing', 'FIN 3380 International Financial Management', 'IMS 4330 Global Human Resource Management', 'IMS 4350 Global Market Entry Strategies', 'IMS 4373 Global Strategy', 'BLAW 4301 International Law', 'IMS 4310 Export Market Development', 'IMS 4340 Managing Global Teams', 'IMS 4V90 Management Internship', 'IMS 4090 Management Internship', 'BA 4090 Management Internship', 'IMS 4335 Social Sector Entrepreneurship and Community Engagement', 'or ENTP 4340 Social Sector Entrepreneurship and Community Engagement', 'or MKT 4360 Social Impact Marketing', 'or BA 4095 Social Sector Engagement and Community Outreach Practicum', 'FIN 3350 Financial Markets and Institutions', 'MECO 4303 Decisions, Behavior, and Business Policy', 'MECO 4351 Industrial Organization and Corporate Strategy', 'MECO 4352 Applied Econometrics and Time Series Analysis', 'ENGY 3301 Managing Carbon Assets: Oil, Gas, and Coal', 'ENGY 3302 Managing Power and Renewable Energy Assets; Sustainability', 'ENGY 3340 Energy Law and Contracts or  International Law', 'FIN 4313 or  Energy Finance', 'MECO 4342 Financial and Business Negotiation Analysis', 'ENTP 3301 Innovation and Entrepreneurship', 'ENTP 3360 or  Entrepreneurial Finance', 'ENTP 4311 Entrepreneurial Strategy and Business Models', 'ENTP 4320 Small Business Management', 'or ENTP 4350 Corporate Entrepreneurship', 'RMIS 3370 or  Principles of Risk Management and Insurance', 'RMIS 4331 or  Business Liability Risk Management and Insurance', 'RMIS 4332 or  Commercial Property Risk Management and Insurance', 'RMIS 4333 or  Enterprise Risk Management', 'RMIS 4334 or  Insurance Law and Contracts', 'REAL 3305 or  Real Estate Principles', 'REAL 3365 or  Real Estate Finance and Principles', 'REAL 4321 or  Real Estate Law and Contracts', 'REAL 4328 or  Real Estate Valuation', 'MKT 3330 Introduction to Professional Selling', 'MKT 3331 Principles of Category Management', 'or MKT 4332 Advanced Professional Sales', 'MKT 4331 or  Digital Prospecting', 'OBHR 4352 Negotiation and Dispute Resolution', 'STAT 3360 Probability and Statistics for Management and Economics', 'or OPRE 3360 Managerial Methods in Decision Making Under Uncertainty', 'ITSS 4300 Database Fundamentals', 'or CS 4347 Database Systems', 'ITSS 4351 Foundations of Business Intelligence', 'ITSS 4352 Introduction to Web Analytics', 'ITSS 4353 Business Analytics', 'ITSS 4354 Advanced Big Data Analytics', 'ITSS 4355 Data Visualization', 'ENGY 3301 Managing Carbon Assets: Oil, Gas, and Coal', 'ENGY 3302 Managing Power and Renewable Energy Assets; Sustainability', 'ENGY 3340 Energy Law and Contracts', 'FIN 4313 or  Energy Finance', 'MECO 4342 Financial and Business Negotiation Analysis', 'GEOS 1303 Physical Geology', 'MECO 3330 or  Energy Economics', 'MKT 3340 Marketing Research', 'OPRE 4330 Global Logistics and Inventory Management', 'ACCT 2301 Introductory Financial Accounting', 'FIN 3320 Business Finance', 'FIN 3390 Introduction to Financial Modeling', 'BLAW 3301 Employment Law', 'OBHR 3330 Introduction to Human Resource Management', 'OBHR 4310 Business Ethics', 'OBHR 4331 Compensation and Benefits Administration', 'OBHR 4333 Performance Management', 'OBHR 4334 Talent Acquisition and Management', 'OBHR 4335 Training and Development', 'OBHR 4336 Labor and Employee Relations', 'OBHR 4350 Introduction to Leading and Managing', 'OBHR 4352 Negotiation and Dispute Resolution', 'OBHR 4354 Leading Organizational Change', 'OBHR 4356 Power and Influence in Organizations', 'RMIS 3370 or  Principles of Risk Management and Insurance', 'RMIS 4331 Business Liability Risk Management and Insurance', 'RMIS 4332 Commercial Property Risk Management and Insurance', 'RMIS 4333 Enterprise Risk Management', 'RMIS 4334 Insurance Law and Contracts', 'RMIS 4336 Systems and Theories', 'RMIS 4338 Foundations of Risk Analytics and Applications', 'MKT 3330 Introduction to Professional Selling', 'FIN 3305 or  Real Estate Principles', 'MKT 3300 Principles of Marketing', 'MKT 3340 Marketing Research', 'MKT 3330 Introduction to Professional Selling', 'MKT 4330 Digital and Internet Marketing', 'MKT 3331 Principles of Category Management', 'MKT 4331 Digital Prospecting', 'MKT 4332 Advanced Professional Sales', 'MKT 4335 Category Buying', 'MKT 4336 E-Retailing', 'MKT 4337 Marketing Analytics', 'MKT 4338 Marketing Content Creation', 'MKT 4339 Marketing Creative Skills and Testing', 'MKT 4340 Consumer Behavior', 'MKT 4341 Predictive Analytics', 'MKT 4350 Advertising', 'MKT 4360 Social Impact Marketing', 'MKT 4370 Marketing Projects', 'MKT 4395 Capstone Senior Project - Marketing', 'MKT 4V83 Individual Study in Marketing', 'MKT 4V90 Marketing Internship', 'OPRE 3320 Integrated Supply Chain Management', 'OPRE 3330 Project Management', 'OPRE 4310 Lean and Six Sigma Processes', 'OPRE 4330 Global Logistics and Inventory Management', 'OPRE 4340 Purchasing and Sourcing Management', 'OPRE 4320 Integrated SCM Information Systems', 'OPRE 4350 Spreadsheet Modeling and Analytics', 'OPRE 4395 Capstone Senior Project - Supply Chain Management']"
