URL Links,Department Initials,Title,Catalog Page,Courses
https://www.utdallas.edu/fact-sheets/jsom/ms-international-management-studies/,jsom,Master of Science in International Management Studies,http://catalog.utdallas.edu/now/graduate/programs/jsom/international-management-studies,"[""Students pursuing the Master of Science in International Management Studies (MS IMS) degree program are required to complete one semester credit hour of MAS 6102 Professional Development course. Degree credit is not earned for program prerequisites, however, the grade achieved in prerequisites will count toward the student's grade-point average (GPA). All program prerequisites must be satisfied within the first semester of graduate study as a degree-seeking student."", 'IMS 6304 International Business Management', 'IMS 6310 International Marketing Decision Making', 'IMS 6360 International Strategy Analysis and Techniques', 'IMS 6365 Cross-cultural Management Analysis', 'IMS 6367 International Management Capstone', 'IMS 6373 Data Analytics for International Business', 'IMS 6302 Legal Aspects of International Business Transactions', 'IMS 6363 Regional Area Studies', 'IMS 6381 Managing Global Teams', 'IMS 6V98 International Management Internship', 'IMS 6V99 Special Topics in International Management Studies', 'BUAN 6312 Applied Econometrics and Time Series Analysis', 'BUAN 6320 Database Foundations for Business Analytics', 'BUAN 6335 Organizing for Business Analytics Platforms', 'BUAN 6344 Web Analytics', 'BUAN 6345 SAP Analytics', 'BUAN 6346 Big Data', 'BUAN 6347 Advanced Big Data Analytics', 'BUAN 6398 Prescriptive Analytics', 'MIS 6309 Business Data Warehousing', 'MIS 6319 Enterprise Resource Planning with SAP', 'MIS 6320 Database Foundations', 'MIS 6332 ERP Configurations and Implementation with SAP', 'MIS 6373 Social Media Business', 'MIS 6378 Customer Relationship Management with Salesforce', 'MIS 6380 Data Visualization', 'OPRE 6301 () Statistics and Data Analysis', 'OPRE 6302 Operations Management', 'OPRE 6304 Operations Analytics', 'OPRE 6332 Spreadsheet Modeling and Analytics', 'OPRE 6335 Risk and Decision Analysis', 'OPRE 6377 Demand and Revenue Analytics', 'FIN 6301 Financial Management', 'FIN 6308 Regulation of Business and Financial Markets', 'FIN 6310 Investment Theory and Practice', 'FIN 6315 Entrepreneurial Finance', 'FIN 6316 Private Equity Finance', 'FIN 6321 Introduction to Real Estate', 'FIN 6322 Real Estate Finance and Investment', 'FIN 6323 Real Estate Market Analysis and Investment', 'FIN 6325 Macroeconomics and Financial Markets', 'FIN 6326 Real Estate Law and Contracts', 'FIN 6330 Behavioral Finance', 'FIN 6352 () Financial Modeling For Valuation', 'FIN 6356 Mergers and Acquisitions', 'FIN 6357 Digital Transformation and Value Creation', 'FIN 6364 Portfolio Analysis and Management', 'FIN 6366 International Financial Management', 'FIN 6370 Advanced Theory of Finance and Its Applications', 'FIN 6380 Global Fund Management', 'ACCT 6301 Financial Accounting', 'ACCT 6386 Governance, Risk Management and Compliance (GRC)', 'OPRE 6301 () Statistics and Data Analysis', 'IMS 6341 International Human Resource Management', 'BPS 6332 Strategic Leadership', 'BPS 6360 Management and Organizational Consulting: Theory and Practice', 'BPS 6379 Business Strategies for Sustainability', 'BUAN 6320 Database Foundations for Business Analytics', 'BUAN 6346 Big Data', 'ENTP 6370 Innovation and Entrepreneurship', 'ENTP 6388 Managing Innovation within the Corporation', 'ENTP 6390 Business Model Innovation', 'MIS 6302 Managing Digital Strategy', 'MIS 6360 Agile Project Management', 'MIS 6393 Foundations of Digital Product Management', 'MKT 6301 () Marketing Management', 'MKT 6309 Marketing Data Analysis and Research', 'MKT 6329 New Product Development', 'MKT 6331 Building and Managing Professional Sales Organizations', 'MKT 6336 Pricing Analytics', 'MKT 6353 Customer Analytics and Insights', 'MKT 6380 Market Entry Strategies', 'OB 6301 Organizational Behavior', 'OB 6303 Managing Organizations', 'OB 6307 Strategic Human Resource Management', 'OB 6331 Power and Politics in Organizations', 'OB 6332 Negotiation and Dispute Resolution', 'OB 6337 Motivational Leadership in Organizations', 'OB 6V99 Special Topics in Organizational Behavior', 'OPRE 6301 () Statistics and Data Analysis', 'OPRE 6335 Risk and Decision Analysis', 'OPRE 6379 Product Lifecycle Management', 'OPRE 6394 Technology and New Product Development', 'MIS 6302 Managing Digital Strategy', 'MIS 6204 Information Technology for Management', 'MIS 6308 System Analysis and Project Management', 'MIS 6309 Business Data Warehousing', 'MIS 6313 Managing IT in the Analytics Age', 'MIS 6319 Enterprise Resource Planning with SAP', 'MIS 6320 Database Foundations', 'MIS 6324 Business Analytics with SAS', 'MIS 6330 Cybersecurity Fundamentals', 'MIS 6344 Web Analytics', 'MIS 6345 SAP Analytics', 'MIS 6360 Agile Project Management', 'MIS 6380 Data Visualization', 'MIS 6396 User Experience Design', 'ACCT 6336 Information Technology Audit and Risk Management', 'ACCT 6386 Governance, Risk Management and Compliance (GRC)', 'ENTP 6360 Startup Launch I', 'ENTP 6370 Innovation and Entrepreneurship', 'ENTP 6375 Technology and New Product Development', 'ENTP 6380 Market Entry Strategies', 'ENTP 6388 Managing Innovation within the Corporation', 'ENTP 6390 Business Model Innovation', 'MKT 6345 Quantitative Marketing Decision-Making', 'OPRE 6301 () Statistics and Data Analysis', 'OPRE 6335 Risk and Decision Analysis', 'OPRE 6379 Product Lifecycle Management', 'OPRE 6394 Technology and New Product Development', 'IMS 7301 International Business', 'BPS 7300 Advanced Strategic Management Seminar I', 'BPS 7301 Advanced Strategic Management Seminar II', 'BPS 7302 Research Methodology', 'ENTP 7300 Foundations of Entrepreneurship', 'ENTP 7301 Technology, Innovation and Entrepreneurship', 'OB 7300 Organization Theory', 'OB 7302 Organization Behavior', 'OB 7306 Macro-Organizational Empirical Investigation', 'OB 7312 Social Network Theory', 'OB 7313 Organizational Decision Making', 'IMS 6314 Global E-Business Marketing', 'MKT 6301 Marketing Management', 'MKT 6309 Marketing Data Analysis and Research', 'MKT 6310 Consumer Behavior Science and Practice', 'MKT 6321 Interactive and Digital Marketing', 'MKT 6329 New Product Development', 'MKT 6332 Advertising and Promotional Strategy', 'MKT 6334 Digital Sales Strategy', 'MKT 6336 Pricing Analytics', 'MKT 6337 Predictive Analytics Using SAS', 'MKT 6341 Marketing Automation and Campaign Management', 'MKT 6342 Marketing Customer Insights Development', 'MKT 6343 Social Media Marketing and Insights', 'MKT 6349 MarTech Ecosystem', 'MKT 6350 Marketing Strategy and Game Theory Framework', 'MKT 6352 Marketing Web Analytics and Insights', 'MKT 6353 Customer Analytics and Insights', 'MKT 6380 Market Entry Strategies', 'MKT 6384 Advanced Marketing Web Analytics and Insights', 'MKT 6345 Quantitative Marketing Decision-Making', 'OPRE 6301 () Statistics and Data Analysis', 'OPRE 6301 () Statistics and Data Analysis', 'OPRE 6302 Operations Management', 'OPRE 6332 Spreadsheet Modeling and Analytics', 'OPRE 6340 Flexible Manufacturing Strategies', 'OPRE 6362 Project Management in Engineering and Operations', 'OPRE 6364 Lean Six Sigma', 'OPRE 6366 Global Supply Chain Management', 'OPRE 6369 Supply Chain Software with SAP', 'OPRE 6370 Global Logistics and Transportation', 'OPRE 6371 Purchasing, Sourcing and Contract Management', 'OPRE 6377 Demand and Revenue Analytics', 'OPRE 6379 Product Lifecycle Management', 'OPRE 6390 Enterprise Resource Planning (ERP)', 'IMS 6363 Regional Area Studies (Sustainability focus)', 'IMS 6358 Strategy for Implementing Sustainability Initiatives in Emerging Markets', 'ACCT 6301 Financial Accounting', 'ACCT 6393 Sustainability and the Role of Modern Corporations', 'BPS 6332 Strategic Leadership', 'BPS 6379 Business Strategies for Sustainability', 'MECO 6303 Business Economics', 'MECO 6318 Energy Economics and The Cost of Regulation', 'MECO 6340 Thinking Strategically', 'MECO 6345 Advanced Managerial Economics', 'MECO 6355 () Deal Making Strategies', 'MECO 6368 Advanced Comparative Institutions of Production and Distribution', 'ENGY 6332 Energy and Sustainability', 'ENTP 6375 Technology and New Product Development', 'OB 6332 Negotiation and Dispute Resolution', 'OPRE 6301 () Statistics and Data Analysis', 'OPRE 6335 Risk and Decision Analysis']"
https://www.utdallas.edu/fact-sheets/jsom/phd-international-management-studies/,jsom,Doctor of Philosophy in International Management Studies,http://catalog.utdallas.edu/now/graduate/programs/jsom/phd#international-management-studies-phd,"['BPS 7300 Advanced Strategic Management Seminar I', 'BPS 7301 Advanced Strategic Management Seminar II', 'BPS 7303 Doctoral Teaching and Writing Seminar', 'ENTP 7300 Foundations of Entrepreneurship', 'ENTP 7301 Technology, Innovation and Entrepreneurship', 'IMS 7301 International Business', 'OB 7300 Organization Theory', 'OB 7302 Organization Behavior', 'OB 7310 Group and Intergroup Processes', 'OB 7312 Social Network Theory', 'OB 7313 Organizational Decision Making', 'MAS 8V00 Special Topics in Management Science [Teaching Practicum]', 'BPS 7302 Research Methodology', 'ECON 6306 Applied Econometrics', 'EPPS 6313 Introduction to Quantitative Methods', 'EPPS 6316 Applied Regression', 'OB 7306 Macro-Organizational Empirical Investigation', 'BPS 7303 Doctoral Teaching and Writing Seminar', 'MAS 8V00 Special Topics in Management Science [Teaching Practicum]', 'MECO 6345 Advanced Managerial Economics', 'MECO 6350 Game Theory', 'MECO 7312 Advanced Statistics and Probability (or a similar course such as )', 'OPRE 7353 Optimization', 'MECO 6320 Econometrics (or  Econometrics I)', 'MECO 6360 Topics in Industrial Organization', 'MECO 7311 Advanced Game Theory', 'MECO 7313 Applied Econometrics', 'MECO 7320 Advanced Econometrics (or  Econometrics II)', 'OPRE 7310 Probability and Stochastic Processes', 'OPRE 7311 Stochastic Models in Operations Research', 'OPRE 7320 Optimal Control Theory and Applications', 'OPRE 7330 Deterministic Models in Operations Research', 'OPRE 7343 Modern Machine Learning Methods']"
https://www.utdallas.edu/fact-sheets/epps/ms-international-political-economy/,epps,Master of Science in International Political Economy,https://catalog.utdallas.edu/now/graduate/programs/epps/public-policy-and-political-economy#master-of-science-in-international-political-economy,"['PPPE 6347 Proseminar in Political Institutions and American Politics', 'PPPE 6329 Ethics, Culture, and Public Policy', 'PPPE 6301 Political-Economic Theories', 'PPPE 6321 Economics for Public Policy', 'EPPS 6313 Introduction to Quantitative Methods', 'EPPS 6316 Applied Regression', 'EPPS 7313 Descriptive and Inferential Statistics', 'EPPS 7316 Regression and Multivariate Analysis', 'PPPE 6342 Research Design II', 'PPPE 6354 Theories and Issues of Development', 'PPPE 6335 Institutions and Development', 'PPPE 6343 Global Health Policy', 'PPPE 6362 Political Development', 'PPPE 6363 Conflict and Development', 'PPPE 6367 Environmental Economics and Policy', 'PPPE 6370 Political Economy of Natural Resources', 'PPPE 6371 Urban Development', 'PPPE 6372 Faith, Ideology, and Development', 'PPPE 6392 Practice of International Development', 'PPPE 6359 Political Economy of Economic Development', 'PPPE 6358 Political Economy of South and Southeast Asia', 'PPPE 6361 Civil Conflict', 'PPPE 6369 National and International Security Strategies and Policies', 'PPPE 6363 Conflict and Development', 'PSCI 6321 Proseminar in Comparative Politics', 'PSCI 6319 Proseminar in International Relations', 'PSCI 6306 Human Rights and International Law', 'PSCI 7318 Conflict Management', 'PSCI 7330 International Conflict', 'PSCI 7335 Theories of International Relations', 'PPPE 7313 Counterterrorism and Counterinsurgency', 'PSCI 6309 International Political Economy', 'PPPE 6319 Political Economy of MNCs', 'PPPE 6368 Political Economy of Finance', 'PPPE 6370 Political Economy of Natural Resources', 'PSCI 6316 International Organizations', 'PPPE 6313 Human Organizations and Social Theory', 'PPPE 6334 Workshop in Environmental and Health GIS/Policy', 'PPPE 6340 Domestic Social Policy', 'PPPE 6341 Health Policy', 'PPPE 6343 Global Health Policy', 'PPPE 6350 Social Stratification', 'PPPE 6356 Health and Illness', 'PPPE 6359 Political Economy of Economic Development', 'PPPE 6365 The Innovation Economy', 'PPPE 6353 Industry, Technology, and Science Policy', 'PPPE 6368 Political Economy of Finance', 'PPPE 6373 Issues in Science, Technology and Society', 'The MQE will cover course material from (EPPS 6313 Introduction to Quantitative Methods and  Applied Regression) and/or ( Descriptive and Inferential Statistics and  Regression and Multivariate Analysis), and  Research Design II. It is required that full-time (and 6 semester credit hours-a-semester part-time) students take  or  the fall semester of the first year and  or  and  in spring. The MQE is administered once a year in late April or May. Student performance will be evaluated as unsatisfactory, satisfactory, or excellent. Those failing the exam will be given a second opportunity to pass at the end of the summer. Those failing the MQE for the second time will not be allowed to continue in the program. Part-time students should seek to complete the required methods sequence by spring of their second year; courses noted above should be taken in the same basic sequence.', 'After passing the MQE, students should begin to explore dissertation topics. In addition to regularly offered courses, students can register for up to six hours of independent studies (PPPE 8V01) to explore dissertation topics with the approval of an individual faculty member to supervise the study. Once a student has identified a likely topic and/or likely dissertation supervisor, the Dissertation Seminar (PPPE 8V98) allows a more formal direction of the dissertation proposal itself. Generally students should defend the proposal in the first semester they register for Dissertation Seminar, and all students should defend a dissertation proposal by the end of the third year (preferably second). Students seeking advising concerning a suitable dissertation topic or appropriate supervisor are encouraged to consult with the Program Head and/or Director of Graduate Studies.', 'Students take free electives in areas of interest to fulfill the 75-semester credit hour PhD requirement. No more than 6 semester credit hours of independent study (PPPE 8V01) may be taken, unless approved by the Director of Graduate Studies or Program Head. Students may enroll in dissertation hours ( Dissertation) in addition to additional coursework after a successful proposal defense.', 'CS 6303 Cyber Security Essentials for Practitioners', 'CS 6305 Data Security and Privacy for Practitioners', 'CS 6306 Cyber Security Analytics & Malware Analysis for Practitioners', 'CS 6308 Cyber Physical Systems and Critical Infrastructure Security for Practitioners', 'MIS 6330 Cybersecurity Fundamentals', 'MIS 6333 Digital Forensics and Incident Management', 'PPPE 6302 Political Violence and Conflict in Cyberspace', 'or PSCI 6302 Political Violence and Conflict in Cyberspace', 'PPPE 6303 Cyber Security Policy', 'or PSCI 6303 Cyber Security Policy', 'PPPE 6308 Governance and Auditing Essentials for Cyber Security', 'or PSCI 6308 Governance and Auditing Essentials for Cyber Security', 'PPPE 6315 Legal Aspects of Cyber Security and Cyber Security Ethics', 'or PSCI 6315 Legal Aspects of Cyber Security and Cyber Security Ethics', 'PPPE 6328 Capstone in Cyber Security and Policy', 'or PSCI 6328 Capstone in Cyber Security and Policy', 'PSYC 6352 Cognitive Psychology Essentials for Cyber Security', 'NOTE: The following four classes (CS 6303 Cyber Security Essentials for Practitioners,  Data Security and Privacy for Practitioners,  Cyber Security Analytics & Malware Analysis for Practitioners, and  Cyber Physical Systems and Critical Infrastructure Security for Practitioners) may be replaced by the following courses ( Information Security,  Network Security,  Data and Applications Security, and another from a list of existing cybersecurity systems in Computer Science courses) if the student has met the individual course pre-requisites and if they are approved by the computer science program head.', 'PPPE 6301 Political-Economic Theories', 'PPPE 6321 Economics for Public Policy', 'PPPE 6365 The Innovation Economy', 'EPPS 6313 Introduction to Quantitative Methods', 'EPPS 6316 Applied Regression', 'EPPS 7313 Descriptive and Inferential Statistics', 'EPPS 7316 Regression and Multivariate Analysis', 'PPPE 6352 World Political Economy', 'PSCI 6309 International Political Economy', 'PPPE 6319 Political Economy of MNCs', 'PPPE 6335 Institutions and Development', 'PPPE 6362 Political Development', 'PPPE 6368 Political Economy of Finance', 'PSCI 6309 International Political Economy', 'PSCI 6316 International Organizations', 'PPPE 6370 Political Economy of Natural Resources', 'PPPE 7V76 Policy Research Workshop in Development Studies', 'PPPE 6310 Research Design I', 'EPPS 6352 Evaluation Research Methods in the Economic, Political and Policy Sciences', 'EPPS 7304 Cost-Benefit Analysis', 'PPPE 6354 Theories and Issues of Development', 'PPPE 6334 or  Workshop in Environmental and Health GIS/Policy', 'PPPE 6335 Institutions and Development', 'PPPE 6343 Global Health Policy', 'PPPE 6352 World Political Economy', 'PPPE 6359 Political Economy of Economic Development', 'PPPE 6362 Political Development', 'PPPE 6363 Conflict and Development', 'PPPE 6367 Environmental Economics and Policy', 'PPPE 6370 Political Economy of Natural Resources', 'PPPE 6371 Urban Development', 'PPPE 6372 Faith, Ideology, and Development', 'PPPE 6392 Practice of International Development', 'PPPE 6361 Civil Conflict', 'PPPE 6369 National and International Security Strategies and Policies', 'PPPE 6363 Conflict and Development', 'PSCI 6300 Proseminar in Comparative Politics and International Relations', 'PSCI 6306 Human Rights and International Law', 'PSCI 7318 Conflict Management', 'PSCI 7330 International Conflict', 'PSCI 7335 Theories of International Relations', 'PPPE 7313 Counterterrorism and Counterinsurgency', 'PSCI 6309 International Political Economy', 'PPPE 6319 Political Economy of MNCs', 'PPPE 6352 World Political Economy', 'PPPE 6368 Political Economy of Finance', 'PPPE 6370 Political Economy of Natural Resources', 'PSCI 6316 International Organizations', 'PPPE 6319 Political Economy of MNCs', 'PPPE 6359 Political Economy of Economic Development', 'PPPE 6365 The Innovation Economy', 'PPPE 6353 Industry, Technology, and Science Policy', 'PPPE 6368 Political Economy of Finance', 'PPPE 6373 Issues in Science, Technology and Society', 'IMS 6204 Global Business (2 semester credit hours)', 'IMS 6212 Global Communication and Negotiations (2 semester credit hours)', 'IMS 6365 Cross-Culture Communication and Management', 'PPPE 6347 Proseminar in Political Institutions and American Politics', 'PPPE 6329 Ethics, Culture, and Public Policy', 'EPPS 6313 Introduction to Quantitative Methods', 'EPPS 6316 Applied Regression', 'EPPS 7313 Descriptive and Inferential Statistics', 'EPPS 7316 Regression and Multivariate Analysis', 'PPPE 6310 Research Design I', 'EPPS 6352 Evaluation Research Methods in the Economic, Political and Policy Sciences', 'EPPS 7304 Cost-Benefit Analysis', 'PPPE 6321 Economics for Public Policy', 'PPPE 6365 The Innovation Economy', 'PPPE 6313 Human Organizations and Social Theory', 'PPPE 6334 or  Workshop in Environmental and Health GIS/Policy', 'PPPE 6340 Domestic Social Policy', 'PPPE 6341 Health Policy', 'PPPE 6343 Global Health Policy', 'PPPE 6350 Social Stratification', 'PPPE 6356 Health and Illness', 'PPPE 6361 Civil Conflict', 'PPPE 6369 National and International Security Strategies and Policies', 'PPPE 6363 Conflict and Development', 'PSCI 6321 Proseminar in Comparative Politics', 'PSCI 6319 Proseminar in International Relations', 'PSCI 6306 Human Rights and International Law', 'PSCI 7318 Conflict Management', 'PSCI 7330 International Conflict', 'PSCI 7335 Theories of International Relations', 'PPPE 7313 Counterterrorism and Counterinsurgency', 'GISC 6381 () Geographic Information Systems Fundamentals', 'GISC 6384 () Advanced Geographic Information Systems', 'GISC 5322 () GPS (Global Positioning System) Satellite Surveying Techniques', 'GISC 5324 () 3D Data Capture and Ground Lidar', 'GISC 6301 GIS Data Analysis Fundamentals', 'GISC 6317 Social and Geospatial Science Programming Fundamentals', 'GISC 6325 () Remote Sensing Fundamentals', 'GISC 6363 Internet Mapping and Information Processing', 'GISC 6385 () GIS Theories, Models and Issues', 'GISC 6388 Advanced GIS Programming', 'GISC 7310 Advanced GIS Data Analysis', 'GISC 7360 GIS Pattern Analysis', 'GISC 7361 Spatial Statistics', 'GISC 7365 () Advanced Remote Sensing', 'EPPS 6326 Machine Learning for Socio-Economic and Geo-Referenced Data', 'EPPS 6346 Qualitative Research Orientation', 'EPPS 6352 Evaluation Research Methods in the Economic, Political and Policy Sciences', 'EPPS 6355 Content Analysis', 'EPPS 7304 Cost-Benefit Analysis', 'EPPS 7318 Structural Equation and Multilevel (Hierarchical) Modeling', 'EPPS 7344 Categorical and Limited Dependent Variables', 'EPPS 7368 Spatial Epidemiology', 'EPPS 7370 Time Series Analysis I', 'EPPS 7371 Time Series Analysis II', 'EPPS 7386 Survey Research', 'EPPS 7390 Bayesian Analysis for Social and Behavioral Sciences', 'EPPS 7V81 Special Topics in Social Science Research Methodology', 'EPPS 6352 Evaluation Research Methods in the Economic, Political and Policy Sciences', 'PPPE 6V91 Evaluation Research (6 semester credit hours)', 'PPPE 6310 Research Design I', 'EPPS 7304 Cost-Benefit Analysis', 'EPPS 6313 Introduction to Quantitative Methods', 'EPPS 6316 Applied Regression', 'EPPS 7313 Descriptive and Inferential Statistics', 'EPPS 7316 Regression and Multivariate Analysis', 'EPPS 6326 Machine Learning for Socio-Economic and Geo-Referenced Data', 'EPPS 7318 Structural Equation and Multilevel (Hierarchical) Modeling', 'EPPS 7344 Categorical and Limited Dependent Variables', 'EPPS 7370 Time Series Analysis I', 'EPPS 7371 Time Series Analysis II', 'EPPS 7386 Survey Research', 'EPPS 7390 Bayesian Analysis for Social and Behavioral Sciences', 'EPPS 7V81 Special Topics in Social Science Research Methodology', 'GISC 7364 Demographic and Epidemiological Analysis and Modeling', 'EPPS 6313 Introduction to Quantitative Methods', 'EPPS 6316 Applied Regression', 'EPPS 7313 Descriptive and Inferential Statistics', 'EPPS 7316 Regression and Multivariate Analysis', 'EPPS 6352 Evaluation Research Methods in the Economic, Political and Policy Sciences', 'EPPS 7304 Cost-Benefit Analysis', 'PA 6315 () Evaluating Program and Organizational Performance ', 'PPPE 6310 Research Design I', 'PPPE 6V91 Evaluation Research (6 semester credit hours)', 'or EPPS 6V97 Internship (6 semester credit hours)']"
https://www.utdallas.edu/fact-sheets/ah/ma-latin-american-studies/,ah,Master of Arts in Latin American Studies,https://catalog.utdallas.edu/now/graduate/programs/ah/latin-american-studies,"['LATS 6300 Introduction to Latin American Studies', 'HIST 6360 Latin American History', 'HIST 6361 Thought, Culture, and Society in Latin America', 'HIST 6365 Mexican History', 'HIST 6368 Genocide and Human Rights in Latin America', 'LIT 6326 Translation Workshop', 'LIT 6382 Latin American Literature', 'VPAS 6334 Iberian Culture and Music', 'LATS 6390 Internship in Latin American Studies', 'LATS 6399 Capstone Project in Latin American Studies', 'Students pursuing the professional option in Latin American Studies must complete thirty-three semester credit hours of coursework, including LATS 6300 and 15 semester credit hours of prescribed electives, and demonstrate reading proficiency in an approved foreign language. They are not required to complete a capstone project and they receive a terminal degree. Normally no more than six semester credit hours of independent study are applicable to the degree plan.']"
